    1 0.000000000 192.168.8.174 → 96.6.20.98   TCP 66 57208 → 443 [ACK] Seq=1 Ack=1 Win=390 Len=0 TSval=1721163151 TSecr=3031836568
    2 0.064646004   96.6.20.98 → 192.168.8.174 TCP 66 [TCP ACKed unseen segment] 443 → 57208 [ACK] Seq=1 Ack=2 Win=243 Len=0 TSval=3031846835 TSecr=1721102029
    3 2.560006988 192.168.8.174 → 172.217.10.67 TCP 66 47116 → 80 [ACK] Seq=1 Ack=1 Win=240 Len=0 TSval=295279630 TSecr=2062818965
    4 2.565595920 172.217.10.67 → 192.168.8.174 TCP 66 [TCP ACKed unseen segment] 80 → 47116 [ACK] Seq=1 Ack=2 Win=240 Len=0 TSval=2062829204 TSecr=295176943
    5 3.647206393 192.184.68.191 → 192.168.8.174 TLSv1.2 97 Encrypted Alert
    6 3.647396079 192.168.8.174 → 192.184.68.191 TCP 66 58772 → 443 [ACK] Seq=1 Ack=32 Win=309 Len=0 TSval=3837803194 TSecr=3415647699
    7 3.648171961 192.168.8.174 → 192.184.68.191 TCP 66 58772 → 443 [FIN, ACK] Seq=1 Ack=32 Win=309 Len=0 TSval=3837803195 TSecr=3415647699
    8 3.660833882 192.184.68.191 → 192.168.8.174 TCP 66 443 → 58772 [FIN, ACK] Seq=32 Ack=2 Win=114 Len=0 TSval=3415647715 TSecr=3837803195
    9 3.661002423 192.168.8.174 → 192.184.68.191 TCP 66 58772 → 443 [ACK] Seq=2 Ack=33 Win=309 Len=0 TSval=3837803208 TSecr=3415647715
   10 7.862617418 GuangLia_09:95:60 → LLDP_Multicast LLDP 196 TTL = 120 System Name = tumbleweed-router.lan System Description = OpenWrt 18.06.1 @ tumbleweed-router 
   11 8.595613556 192.168.8.174 → 151.101.1.140 TLSv1.2 112 Application Data
   12 8.609206201 151.101.1.140 → 192.168.8.174 TLSv1.2 112 Application Data
   13 8.609358805 192.168.8.174 → 151.101.1.140 TCP 66 36058 → 443 [ACK] Seq=47 Ack=47 Win=2564 Len=0 TSval=4222978405 TSecr=2541107582
   14 8.682485133 GuangLia_09:95:60 → Raspberr_fa:9c:3e ARP 60 Who has 192.168.8.174? Tell 192.168.8.1
   15 8.682559351 Raspberr_fa:9c:3e → GuangLia_09:95:60 ARP 42 192.168.8.174 is at b8:27:eb:fa:9c:3e
   16 10.239990625 192.168.8.174 → 96.6.20.98   TCP 66 [TCP Dup ACK 1#1] 57208 → 443 [ACK] Seq=1 Ack=1 Win=390 Len=0 TSval=1721173391 TSecr=3031846835
   17 10.277213786   96.6.20.98 → 192.168.8.174 TCP 66 [TCP Dup ACK 2#1] [TCP ACKed unseen segment] 443 → 57208 [ACK] Seq=1 Ack=2 Win=243 Len=0 TSval=3031857046 TSecr=1721102029
   18 12.799981254 192.168.8.174 → 172.217.10.67 TCP 66 [TCP Dup ACK 3#1] 47116 → 80 [ACK] Seq=1 Ack=1 Win=240 Len=0 TSval=295289870 TSecr=2062829204
   19 12.807044190 172.217.10.67 → 192.168.8.174 TCP 66 [TCP Dup ACK 4#1] [TCP ACKed unseen segment] 80 → 47116 [ACK] Seq=1 Ack=2 Win=240 Len=0 TSval=2062839444 TSecr=295176943
   20 15.163546791 192.168.8.174 → 172.217.10.67 TCP 66 [TCP Previous segment not captured] 47116 → 80 [FIN, ACK] Seq=2 Ack=1 Win=240 Len=0 TSval=295292234 TSecr=2062839444
   21 15.167144847 172.217.10.67 → 192.168.8.174 TCP 66 [TCP ACKed unseen segment] 80 → 47116 [FIN, ACK] Seq=1 Ack=3 Win=240 Len=0 TSval=2062841808 TSecr=295292234
   22 15.167263024 192.168.8.174 → 172.217.10.67 TCP 66 47116 → 80 [ACK] Seq=3 Ack=2 Win=240 Len=0 TSval=295292237 TSecr=2062841808
   23 16.596659872 192.168.8.174 → 13.225.227.2 TLSv1.2 112 Application Data
   24 16.600316834 13.225.227.2 → 192.168.8.174 TLSv1.2 112 Application Data
   25 16.600475896 192.168.8.174 → 13.225.227.2 TCP 66 35330 → 443 [ACK] Seq=47 Ack=47 Win=237 Len=0 TSval=1451511809 TSecr=378970973
   26 17.598106570 192.168.8.174 → 172.217.10.98 TLSv1.2 112 Application Data
   27 17.605959971 172.217.10.98 → 192.168.8.174 TLSv1.2 112 Application Data
   28 17.606072783 192.168.8.174 → 172.217.10.98 TCP 66 53502 → 443 [ACK] Seq=47 Ack=47 Win=329 Len=0 TSval=315998088 TSecr=2655548
   29 20.479975086 192.168.8.174 → 96.6.20.98   TCP 66 [TCP Dup ACK 1#2] 57208 → 443 [ACK] Seq=1 Ack=1 Win=390 Len=0 TSval=1721183631 TSecr=3031857046
   30 20.520913281   96.6.20.98 → 192.168.8.174 TCP 66 [TCP Dup ACK 2#2] [TCP ACKed unseen segment] 443 → 57208 [ACK] Seq=1 Ack=2 Win=243 Len=0 TSval=3031867289 TSecr=1721102029
   31 28.599646635 192.168.8.174 → 13.225.227.2 TLSv1.2 112 Application Data
   32 28.607951179 13.225.227.2 → 192.168.8.174 TLSv1.2 112 Application Data
   33 28.608034877 192.168.8.174 → 13.225.227.2 TCP 66 35336 → 443 [ACK] Seq=47 Ack=47 Win=237 Len=0 TSval=1451523817 TSecr=378916171
   34 29.600652008 192.168.8.174 → 172.217.10.98 TLSv1.2 112 Application Data
   35 29.600848934 192.168.8.174 → 172.217.10.98 TLSv1.2 112 Application Data
   36 29.612248828 172.217.10.98 → 192.168.8.174 TLSv1.2 112 Application Data
   37 29.612342109 192.168.8.174 → 172.217.10.98 TCP 66 53516 → 443 [ACK] Seq=47 Ack=47 Win=237 Len=0 TSval=316010094 TSecr=2768400519
   38 29.612251745 172.217.10.98 → 192.168.8.174 TLSv1.2 112 Application Data
   39 29.612374349 192.168.8.174 → 172.217.10.98 TCP 66 53514 → 443 [ACK] Seq=47 Ack=47 Win=269 Len=0 TSval=316010095 TSecr=3970192025
   40 30.719976460 192.168.8.174 → 96.6.20.98   TCP 66 [TCP Dup ACK 1#3] 57208 → 443 [ACK] Seq=1 Ack=1 Win=390 Len=0 TSval=1721193871 TSecr=3031867289
   41 30.757297015   96.6.20.98 → 192.168.8.174 TCP 66 [TCP Dup ACK 2#3] [TCP ACKed unseen segment] 443 → 57208 [ACK] Seq=1 Ack=2 Win=243 Len=0 TSval=3031877527 TSecr=1721102029
   42 33.642424812 GuangLia_09:95:60 → Raspberr_fa:9c:3e ARP 60 Who has 192.168.8.174? Tell 192.168.8.1
   43 33.642512051 Raspberr_fa:9c:3e → GuangLia_09:95:60 ARP 42 192.168.8.174 is at b8:27:eb:fa:9c:3e
   44 36.602898384 192.168.8.174 → 172.217.12.196 TLSv1.2 112 Application Data
   45 36.652917628 172.217.12.196 → 192.168.8.174 TLSv1.2 112 Application Data
   46 36.653047940 192.168.8.174 → 172.217.12.196 TCP 66 56204 → 443 [ACK] Seq=47 Ack=47 Win=294 Len=0 TSval=3878546221 TSecr=3906143812
   47 37.892649624 GuangLia_09:95:60 → LLDP_Multicast LLDP 196 TTL = 120 System Name = tumbleweed-router.lan System Description = OpenWrt 18.06.1 @ tumbleweed-router 
   48 40.959979179 192.168.8.174 → 96.6.20.98   TCP 66 [TCP Dup ACK 1#4] 57208 → 443 [ACK] Seq=1 Ack=1 Win=390 Len=0 TSval=1721204111 TSecr=3031877527
   49 40.996022499   96.6.20.98 → 192.168.8.174 TCP 66 [TCP Dup ACK 2#4] [TCP ACKed unseen segment] 443 → 57208 [ACK] Seq=1 Ack=2 Win=243 Len=0 TSval=3031887766 TSecr=1721102029
   50 42.164976067 192.168.8.174 → 172.217.12.196 TLSv1.2 112 Application Data
   51 42.179839279 172.217.12.196 → 192.168.8.174 TCP 66 443 → 56204 [ACK] Seq=47 Ack=93 Win=252 Len=0 TSval=3906149343 TSecr=3878551733
   52 42.391056046 192.168.8.174 → 172.217.12.196 TLSv1.2 97 Encrypted Alert
   53 42.391189639 192.168.8.174 → 172.217.12.196 TCP 66 56204 → 443 [FIN, ACK] Seq=124 Ack=47 Win=294 Len=0 TSval=3878551959 TSecr=3906149343
   54 42.394967590 172.217.12.196 → 192.168.8.174 TCP 66 443 → 56204 [ACK] Seq=47 Ack=124 Win=252 Len=0 TSval=3906149564 TSecr=3878551959
   55 42.394970194 172.217.12.196 → 192.168.8.174 TCP 66 443 → 56204 [FIN, ACK] Seq=47 Ack=124 Win=252 Len=0 TSval=3906149564 TSecr=3878551959
   56 42.395056913 192.168.8.174 → 172.217.12.196 TCP 66 56204 → 443 [ACK] Seq=125 Ack=48 Win=294 Len=0 TSval=3878551963 TSecr=3906149564
   57 42.395827065 172.217.12.196 → 192.168.8.174 TCP 66 443 → 56204 [ACK] Seq=48 Ack=125 Win=252 Len=0 TSval=3906149564 TSecr=3878551959
   58 46.604153718 192.168.8.174 → 104.108.45.231 TLSv1.2 112 Application Data
   59 46.691443619 104.108.45.231 → 192.168.8.174 TLSv1.2 112 Application Data
   60 46.691628931 192.168.8.174 → 104.108.45.231 TCP 66 33696 → 443 [ACK] Seq=47 Ack=47 Win=245 Len=0 TSval=3604216347 TSecr=420443798
   61 50.605898237 192.168.8.174 → 172.217.10.72 TLSv1.2 112 Application Data
   62 50.614218094 172.217.10.72 → 192.168.8.174 TLSv1.2 112 Application Data
   63 50.614356687 192.168.8.174 → 172.217.10.72 TCP 66 58532 → 443 [ACK] Seq=47 Ack=47 Win=245 Len=0 TSval=302600324 TSecr=2836074156
   64 51.200026631 192.168.8.174 → 96.6.20.98   TCP 66 [TCP Dup ACK 1#5] 57208 → 443 [ACK] Seq=1 Ack=1 Win=390 Len=0 TSval=1721214351 TSecr=3031887766
   65 51.237423330   96.6.20.98 → 192.168.8.174 TCP 66 [TCP Dup ACK 2#5] [TCP ACKed unseen segment] 443 → 57208 [ACK] Seq=1 Ack=2 Win=243 Len=0 TSval=3031898006 TSecr=1721102029
   66 53.606974224 192.168.8.174 → 151.101.1.140 TLSv1.2 112 Application Data
   67 53.607148650 192.168.8.174 → 35.190.72.21 TLSv1.2 112 Application Data
   68 53.613606745 35.190.72.21 → 192.168.8.174 TLSv1.2 112 Application Data
   69 53.613687525 192.168.8.174 → 35.190.72.21 TCP 66 40856 → 443 [ACK] Seq=47 Ack=47 Win=245 Len=0 TSval=503237174 TSecr=783322490
   70 53.618257452 151.101.1.140 → 192.168.8.174 TLSv1.2 112 Application Data
   71 53.618344691 192.168.8.174 → 151.101.1.140 TCP 66 36060 → 443 [ACK] Seq=47 Ack=47 Win=318 Len=0 TSval=4223023415 TSecr=1151823123
   72 54.168070635 192.168.8.174 → 96.6.20.98   TLSv1.2 97 [TCP Previous segment not captured] , Encrypted Alert
   73 54.168278968 192.168.8.174 → 96.6.20.98   TCP 66 57208 → 443 [FIN, ACK] Seq=33 Ack=1 Win=390 Len=0 TSval=1721217320 TSecr=3031898006
   74 54.204715983   96.6.20.98 → 192.168.8.174 TLSv1.2 97 [TCP ACKed unseen segment] , Encrypted Alert
   75 54.204902597 192.168.8.174 → 96.6.20.98   TCP 54 57208 → 443 [RST] Seq=34 Win=0 Len=0
   76 54.205730978   96.6.20.98 → 192.168.8.174 TCP 66 443 → 57208 [RST, ACK] Seq=32 Ack=34 Win=243 Len=0 TSval=3031900974 TSecr=1721217319
   77 56.608242640 192.168.8.174 → 13.225.230.11 TLSv1.2 112 Application Data
   78 56.650365722 13.225.230.11 → 192.168.8.174 TLSv1.2 112 Application Data
   79 56.650486138 192.168.8.174 → 13.225.230.11 TCP 66 49166 → 443 [ACK] Seq=47 Ack=47 Win=237 Len=0 TSval=905058464 TSecr=377711075
   80 58.682439490 GuangLia_09:95:60 → Raspberr_fa:9c:3e ARP 60 Who has 192.168.8.174? Tell 192.168.8.1
   81 58.682525531 Raspberr_fa:9c:3e → GuangLia_09:95:60 ARP 42 192.168.8.174 is at b8:27:eb:fa:9c:3e
   82 67.609231471 192.168.8.174 → 151.101.1.140 TLSv1.2 112 Application Data
   83 67.619423089 151.101.1.140 → 192.168.8.174 TLSv1.2 112 Application Data
   84 67.619531943 192.168.8.174 → 151.101.1.140 TCP 66 36058 → 443 [ACK] Seq=93 Ack=93 Win=2564 Len=0 TSval=4223037416 TSecr=2541122335
   85 67.922662117 GuangLia_09:95:60 → LLDP_Multicast LLDP 196 TTL = 120 System Name = tumbleweed-router.lan System Description = OpenWrt 18.06.1 @ tumbleweed-router 
   86 70.980306222 fe80::206f:f4d8:f17e:534b → ff02::1:2    DHCPv6 142 Solicit XID: 0xe018af CID: 00044814b8f23c364c102fa474664a5ca603 
   87 74.610908569 192.168.8.174 → 13.225.227.2 TLSv1.2 112 Application Data
   88 74.623064761 13.225.227.2 → 192.168.8.174 TLSv1.2 112 Application Data
   89 74.623206635 192.168.8.174 → 13.225.227.2 TCP 66 35330 → 443 [ACK] Seq=93 Ack=93 Win=237 Len=0 TSval=1451569832 TSecr=378976775
   90 75.611772027 192.168.8.174 → 172.217.10.98 TLSv1.2 112 Application Data
   91 75.618105643 172.217.10.98 → 192.168.8.174 TLSv1.2 112 Application Data
   92 75.618242986 192.168.8.174 → 172.217.10.98 TCP 66 53502 → 443 [ACK] Seq=93 Ack=93 Win=329 Len=0 TSval=316056101 TSecr=2713561
   93 76.042693098 fe80::e695:6eff:fe49:9560 → ff02::1:ff7e:534b ICMPv6 86 Neighbor Solicitation for fe80::206f:f4d8:f17e:534b from e4:95:6e:49:95:60
   94 77.082648451 fe80::e695:6eff:fe49:9560 → ff02::1:ff7e:534b ICMPv6 86 Neighbor Solicitation for fe80::206f:f4d8:f17e:534b from e4:95:6e:49:95:60
   95 78.122617708 fe80::e695:6eff:fe49:9560 → ff02::1:ff7e:534b ICMPv6 86 Neighbor Solicitation for fe80::206f:f4d8:f17e:534b from e4:95:6e:49:95:60
   96 80.169736164 192.168.8.174 → 13.225.227.2 TLSv1.2 112 Application Data
   97 80.224024811 13.225.227.2 → 192.168.8.174 TCP 66 443 → 35330 [ACK] Seq=93 Ack=139 Win=122 Len=0 TSval=378977336 TSecr=1451575379
   98 80.372181135 192.168.8.174 → 13.225.227.2 TLSv1.2 97 Encrypted Alert
   99 80.372395977 192.168.8.174 → 13.225.227.2 TCP 66 35330 → 443 [FIN, ACK] Seq=170 Ack=93 Win=237 Len=0 TSval=1451575582 TSecr=378977336
  100 80.379976462 13.225.227.2 → 192.168.8.174 TCP 66 443 → 35330 [ACK] Seq=93 Ack=170 Win=122 Len=0 TSval=378977351 TSecr=1451575582
  101 80.379980472 13.225.227.2 → 192.168.8.174 TCP 66 443 → 35330 [FIN, ACK] Seq=93 Ack=170 Win=122 Len=0 TSval=378977351 TSecr=1451575582
  102 80.380110732 192.168.8.174 → 13.225.227.2 TCP 66 35330 → 443 [ACK] Seq=171 Ack=94 Win=237 Len=0 TSval=1451575589 TSecr=378977351
  103 80.379984066 13.225.227.2 → 192.168.8.174 TCP 66 443 → 35330 [ACK] Seq=94 Ack=171 Win=122 Len=0 TSval=378977351 TSecr=1451575582
  104 81.242740934 fe80::e695:6eff:fe49:9560 → ff02::1:ff7e:534b ICMPv6 86 Neighbor Solicitation for fe80::206f:f4d8:f17e:534b from e4:95:6e:49:95:60
  105 82.172388835 192.168.8.174 → 172.217.10.98 TLSv1.2 112 Application Data
  106 82.182218840 172.217.10.98 → 192.168.8.174 TCP 66 443 → 53502 [ACK] Seq=93 Ack=139 Win=248 Len=0 TSval=2720127 TSecr=316062655
  107 82.282629767 fe80::e695:6eff:fe49:9560 → ff02::1:ff7e:534b ICMPv6 86 Neighbor Solicitation for fe80::206f:f4d8:f17e:534b from e4:95:6e:49:95:60
  108 82.385412400 192.168.8.174 → 172.217.10.98 TLSv1.2 97 Encrypted Alert
  109 82.385505525 192.168.8.174 → 172.217.10.98 TCP 66 53502 → 443 [FIN, ACK] Seq=170 Ack=93 Win=329 Len=0 TSval=316062868 TSecr=2720127
  110 82.398631400 172.217.10.98 → 192.168.8.174 TCP 66 443 → 53502 [ACK] Seq=93 Ack=170 Win=248 Len=0 TSval=2720335 TSecr=316062868
  111 82.401977894 172.217.10.98 → 192.168.8.174 TCP 66 443 → 53502 [FIN, ACK] Seq=93 Ack=170 Win=248 Len=0 TSval=2720335 TSecr=316062868
  112 82.402030133 192.168.8.174 → 172.217.10.98 TCP 66 53502 → 443 [ACK] Seq=171 Ack=94 Win=329 Len=0 TSval=316062884 TSecr=2720335
  113 82.401979404 172.217.10.98 → 192.168.8.174 TCP 66 443 → 53502 [ACK] Seq=94 Ack=171 Win=248 Len=0 TSval=2720336 TSecr=316062868
  114 83.322649638 fe80::e695:6eff:fe49:9560 → ff02::1:ff7e:534b ICMPv6 86 Neighbor Solicitation for fe80::206f:f4d8:f17e:534b from e4:95:6e:49:95:60
  115 85.242410559 GuangLia_09:95:60 → Raspberr_fa:9c:3e ARP 60 Who has 192.168.8.174? Tell 192.168.8.1
  116 85.242503840 Raspberr_fa:9c:3e → GuangLia_09:95:60 ARP 42 192.168.8.174 is at b8:27:eb:fa:9c:3e
  117 86.243023217  192.168.8.1 → 192.168.8.255 BROWSER 256 Local Master Announcement GL-AR750S, Workstation, Server, Print Queue Server, Xenix Server, NT Workstation, NT Server, Master Browser, Domain Master Browser, DFS server
  118 86.243313424  192.168.8.1 → 192.168.8.255 BROWSER 252 Domain/Workgroup Announcement WORKGROUP, NT Workstation, Domain Enum
  119 86.613141029 192.168.8.174 → 13.225.227.2 TLSv1.2 112 Application Data
  120 86.625647375 13.225.227.2 → 192.168.8.174 TLSv1.2 112 Application Data
  121 86.625827895 192.168.8.174 → 13.225.227.2 TCP 66 35336 → 443 [ACK] Seq=93 Ack=93 Win=237 Len=0 TSval=1451581835 TSecr=378921973
  122 87.614135349 192.168.8.174 → 172.217.10.98 TLSv1.2 112 Application Data
  123 87.614451858 192.168.8.174 → 172.217.10.98 TLSv1.2 112 Application Data
  124 87.617885071 172.217.10.98 → 192.168.8.174 TLSv1.2 112 Application Data
  125 87.617998039 192.168.8.174 → 172.217.10.98 TCP 66 53514 → 443 [ACK] Seq=93 Ack=93 Win=269 Len=0 TSval=316068100 TSecr=3970250038
  126 87.624564154 172.217.10.98 → 192.168.8.174 TLSv1.2 112 Application Data
  127 87.624611445 192.168.8.174 → 172.217.10.98 TCP 66 53516 → 443 [ACK] Seq=93 Ack=93 Win=237 Len=0 TSval=316068107 TSecr=2768458533
  128 92.173231513 192.168.8.174 → 13.225.227.2 TLSv1.2 112 Application Data
  129 92.226599851 13.225.227.2 → 192.168.8.174 TCP 66 443 → 35336 [ACK] Seq=93 Ack=139 Win=122 Len=0 TSval=378922534 TSecr=1451587383
  130 92.384146074 192.168.8.174 → 13.225.227.2 TLSv1.2 97 Encrypted Alert
  131 92.384341438 192.168.8.174 → 13.225.227.2 TCP 66 35336 → 443 [FIN, ACK] Seq=170 Ack=93 Win=237 Len=0 TSval=1451587594 TSecr=378922534
  132 92.389818078 13.225.227.2 → 192.168.8.174 TCP 66 443 → 35336 [ACK] Seq=93 Ack=170 Win=122 Len=0 TSval=378922550 TSecr=1451587594
  133 92.401704896 13.225.227.2 → 192.168.8.174 TCP 66 443 → 35336 [FIN, ACK] Seq=93 Ack=171 Win=122 Len=0 TSval=378922550 TSecr=1451587594
  134 92.401803281 192.168.8.174 → 13.225.227.2 TCP 66 35336 → 443 [ACK] Seq=171 Ack=94 Win=237 Len=0 TSval=1451587611 TSecr=378922550
  135 93.174645561 192.168.8.174 → 172.217.10.98 TLSv1.2 112 Application Data
  136 93.186477692 172.217.10.98 → 192.168.8.174 TCP 66 443 → 53514 [ACK] Seq=93 Ack=139 Win=248 Len=0 TSval=3970255605 TSecr=316073657
  137 93.327428057 192.168.8.174 → 172.217.10.98 TLSv1.2 97 Encrypted Alert
  138 93.327530609 192.168.8.174 → 172.217.10.98 TCP 66 53514 → 443 [FIN, ACK] Seq=170 Ack=93 Win=269 Len=0 TSval=316073810 TSecr=3970255605
  139 93.331598089 172.217.10.98 → 192.168.8.174 TCP 66 443 → 53514 [ACK] Seq=93 Ack=170 Win=248 Len=0 TSval=3970255751 TSecr=316073810
  140 93.331601214 172.217.10.98 → 192.168.8.174 TCP 66 443 → 53514 [FIN, ACK] Seq=93 Ack=170 Win=248 Len=0 TSval=3970255751 TSecr=316073810
  141 93.331733922 192.168.8.174 → 172.217.10.98 TCP 66 53514 → 443 [ACK] Seq=171 Ack=94 Win=269 Len=0 TSval=316073814 TSecr=3970255751
  142 93.331781839 172.217.10.98 → 192.168.8.174 TCP 66 443 → 53514 [ACK] Seq=94 Ack=171 Win=248 Len=0 TSval=3970255752 TSecr=316073810
  143 94.175260601 192.168.8.174 → 172.217.10.98 TLSv1.2 112 Application Data
  144 94.184324412 172.217.10.98 → 192.168.8.174 TCP 66 443 → 53516 [ACK] Seq=93 Ack=139 Win=244 Len=0 TSval=2768465099 TSecr=316074658
  145 94.332877396 192.168.8.174 → 172.217.10.98 TLSv1.2 97 Encrypted Alert
  146 94.332953646 192.168.8.174 → 172.217.10.98 TCP 66 53516 → 443 [FIN, ACK] Seq=170 Ack=93 Win=237 Len=0 TSval=316074815 TSecr=2768465099
  147 94.346743059 172.217.10.98 → 192.168.8.174 TCP 66 443 → 53516 [ACK] Seq=93 Ack=170 Win=244 Len=0 TSval=2768465256 TSecr=316074815
  148 94.347384514 172.217.10.98 → 192.168.8.174 TCP 66 443 → 53516 [FIN, ACK] Seq=93 Ack=170 Win=244 Len=0 TSval=2768465256 TSecr=316074815
  149 94.347450972 192.168.8.174 → 172.217.10.98 TCP 66 53516 → 443 [ACK] Seq=171 Ack=94 Win=237 Len=0 TSval=316074830 TSecr=2768465256
  150 94.348048886 172.217.10.98 → 192.168.8.174 TCP 66 443 → 53516 [ACK] Seq=94 Ack=171 Win=244 Len=0 TSval=2768465256 TSecr=316074815
  151 97.932647597 GuangLia_09:95:60 → LLDP_Multicast LLDP 196 TTL = 120 System Name = tumbleweed-router.lan System Description = OpenWrt 18.06.1 @ tumbleweed-router 
  152 105.616049032 192.168.8.174 → 104.108.45.231 TLSv1.2 112 Application Data
  153 105.702100909 104.108.45.231 → 192.168.8.174 TLSv1.2 112 Application Data
  154 105.702244398 192.168.8.174 → 104.108.45.231 TCP 66 33696 → 443 [ACK] Seq=93 Ack=93 Win=245 Len=0 TSval=3604275358 TSecr=420502812
  155 108.616864864 192.168.8.174 → 172.217.10.72 TLSv1.2 112 Application Data
  156 108.620969688 172.217.10.72 → 192.168.8.174 TLSv1.2 112 Application Data
  157 108.621048126 192.168.8.174 → 172.217.10.72 TCP 66 58532 → 443 [ACK] Seq=93 Ack=93 Win=245 Len=0 TSval=302658331 TSecr=2836132165
  158 109.177545022 192.168.8.174 → 104.108.45.231 TLSv1.2 112 Application Data
  159 109.303655246 104.108.45.231 → 192.168.8.174 TCP 66 443 → 33696 [ACK] Seq=93 Ack=139 Win=253 Len=0 TSval=420506412 TSecr=3604278833
  160 109.360135442 192.168.8.174 → 104.108.45.231 TLSv1.2 97 Encrypted Alert
  161 109.360371379 192.168.8.174 → 104.108.45.231 TCP 66 33696 → 443 [FIN, ACK] Seq=170 Ack=93 Win=245 Len=0 TSval=3604279016 TSecr=420506412
  162 109.441989995 104.108.45.231 → 192.168.8.174 TCP 66 443 → 33696 [ACK] Seq=93 Ack=170 Win=253 Len=0 TSval=420506554 TSecr=3604279016
  163 109.444246025 104.108.45.231 → 192.168.8.174 TLSv1.2 97 Encrypted Alert
  164 109.444339983 192.168.8.174 → 104.108.45.231 TCP 54 33696 → 443 [RST] Seq=170 Win=0 Len=0
  165 109.444247692 104.108.45.231 → 192.168.8.174 TCP 66 443 → 33696 [FIN, ACK] Seq=124 Ack=170 Win=253 Len=0 TSval=420506555 TSecr=3604279016
  166 109.444404410 192.168.8.174 → 104.108.45.231 TCP 54 33696 → 443 [RST] Seq=170 Win=0 Len=0
  167 109.444437483 104.108.45.231 → 192.168.8.174 TCP 66 443 → 33696 [ACK] Seq=125 Ack=171 Win=253 Len=0 TSval=420506555 TSecr=3604279016
  168 109.444461597 192.168.8.174 → 104.108.45.231 TCP 54 33696 → 443 [RST] Seq=171 Win=0 Len=0
  169 110.762438043 GuangLia_09:95:60 → Raspberr_fa:9c:3e ARP 60 Who has 192.168.8.174? Tell 192.168.8.1
  170 110.762501584 Raspberr_fa:9c:3e → GuangLia_09:95:60 ARP 42 192.168.8.174 is at b8:27:eb:fa:9c:3e
  171 111.618660572 192.168.8.174 → 151.101.1.140 TLSv1.2 112 Application Data
  172 111.618833019 192.168.8.174 → 35.190.72.21 TLSv1.2 112 Application Data
  173 111.625343508 35.190.72.21 → 192.168.8.174 TLSv1.2 112 Application Data
  174 111.625441008 192.168.8.174 → 35.190.72.21 TCP 66 40856 → 443 [ACK] Seq=93 Ack=93 Win=245 Len=0 TSval=503295186 TSecr=783380499
  175 111.631965039 151.101.1.140 → 192.168.8.174 TLSv1.2 112 Application Data
  176 111.632050507 192.168.8.174 → 151.101.1.140 TCP 66 36060 → 443 [ACK] Seq=93 Ack=93 Win=318 Len=0 TSval=4223081429 TSecr=1151837626
  177 114.178216996 192.168.8.174 → 172.217.10.72 TLSv1.2 112 Application Data
  178 114.197372268 172.217.10.72 → 192.168.8.174 TCP 66 443 → 58532 [ACK] Seq=93 Ack=139 Win=248 Len=0 TSval=2836137731 TSecr=302663888
  179 114.305953618 192.168.8.174 → 172.217.10.72 TLSv1.2 97 Encrypted Alert
  180 114.306053513 192.168.8.174 → 172.217.10.72 TCP 66 58532 → 443 [FIN, ACK] Seq=170 Ack=93 Win=245 Len=0 TSval=302664016 TSecr=2836137731
  181 114.312455253 172.217.10.72 → 192.168.8.174 TCP 66 443 → 58532 [ACK] Seq=93 Ack=170 Win=248 Len=0 TSval=2836137854 TSecr=302664015
  182 114.312458430 172.217.10.72 → 192.168.8.174 TCP 66 443 → 58532 [FIN, ACK] Seq=93 Ack=170 Win=248 Len=0 TSval=2836137854 TSecr=302664015
  183 114.312577961 192.168.8.174 → 172.217.10.72 TCP 66 58532 → 443 [ACK] Seq=171 Ack=94 Win=245 Len=0 TSval=302664022 TSecr=2836137854
  184 114.312638065 172.217.10.72 → 192.168.8.174 TCP 66 443 → 58532 [ACK] Seq=94 Ack=171 Win=248 Len=0 TSval=2836137854 TSecr=302664016
  185 115.620871161 192.168.8.174 → 13.225.230.11 TLSv1.2 112 Application Data
  186 115.627349775 13.225.230.11 → 192.168.8.174 TLSv1.2 112 Application Data
  187 115.627475816 192.168.8.174 → 13.225.230.11 TCP 66 49166 → 443 [ACK] Seq=93 Ack=93 Win=237 Len=0 TSval=905117441 TSecr=377716977
  188 116.180085693 192.168.8.174 → 151.101.1.140 TLSv1.2 112 Application Data
  189 116.231830911 151.101.1.140 → 192.168.8.174 TCP 66 443 → 36060 [ACK] Seq=93 Ack=139 Win=68 Len=0 TSval=1151838777 TSecr=4223085977
  190 116.243086638 192.168.8.174 → 151.101.1.140 TLSv1.2 97 Encrypted Alert
  191 116.243220752 192.168.8.174 → 151.101.1.140 TCP 66 36060 → 443 [FIN, ACK] Seq=170 Ack=93 Win=318 Len=0 TSval=4223086040 TSecr=1151838777
  192 116.251918679 151.101.1.140 → 192.168.8.174 TCP 66 443 → 36060 [ACK] Seq=93 Ack=170 Win=68 Len=0 TSval=1151838782 TSecr=4223086040
  193 116.257281934 151.101.1.140 → 192.168.8.174 TLSv1.2 97 Encrypted Alert
  194 116.257361986 192.168.8.174 → 151.101.1.140 TCP 54 36060 → 443 [RST] Seq=171 Win=0 Len=0
  195 116.257284434 151.101.1.140 → 192.168.8.174 TCP 66 443 → 36060 [FIN, ACK] Seq=124 Ack=171 Win=68 Len=0 TSval=1151838782 TSecr=4223086040
  196 116.257428704 192.168.8.174 → 151.101.1.140 TCP 54 36060 → 443 [RST] Seq=171 Win=0 Len=0
  197 118.181425635 192.168.8.174 → 35.190.72.21 TLSv1.2 112 Application Data
  198 118.226469532 35.190.72.21 → 192.168.8.174 TCP 66 443 → 40856 [ACK] Seq=93 Ack=139 Win=248 Len=0 TSval=783387102 TSecr=503301742
  199 118.265199448 192.168.8.174 → 35.190.72.21 TLSv1.2 97 Encrypted Alert
  200 118.265357833 192.168.8.174 → 35.190.72.21 TCP 66 40856 → 443 [FIN, ACK] Seq=170 Ack=93 Win=245 Len=0 TSval=503301826 TSecr=783387102
  201 118.274477737 35.190.72.21 → 192.168.8.174 TCP 66 443 → 40856 [ACK] Seq=93 Ack=170 Win=248 Len=0 TSval=783387145 TSecr=503301826
  202 118.274483726 35.190.72.21 → 192.168.8.174 TCP 66 443 → 40856 [FIN, ACK] Seq=93 Ack=170 Win=248 Len=0 TSval=783387145 TSecr=503301826
  203 118.274625288 192.168.8.174 → 35.190.72.21 TCP 66 40856 → 443 [ACK] Seq=171 Ack=94 Win=245 Len=0 TSval=503301835 TSecr=783387145
  204 118.274485549 35.190.72.21 → 192.168.8.174 TCP 66 443 → 40856 [ACK] Seq=94 Ack=171 Win=248 Len=0 TSval=783387145 TSecr=503301826
  205 120.182582603 192.168.8.174 → 13.225.230.11 TLSv1.2 112 Application Data
  206 120.234438080 13.225.230.11 → 192.168.8.174 TCP 66 443 → 49166 [ACK] Seq=93 Ack=139 Win=122 Len=0 TSval=377717438 TSecr=905121996
  207 120.288723390 192.168.8.174 → 13.225.230.11 TLSv1.2 97 Encrypted Alert
  208 120.288968285 192.168.8.174 → 13.225.230.11 TCP 66 49166 → 443 [FIN, ACK] Seq=170 Ack=93 Win=237 Len=0 TSval=905122103 TSecr=377717438
  209 120.295144296 13.225.230.11 → 192.168.8.174 TCP 66 443 → 49166 [ACK] Seq=93 Ack=170 Win=122 Len=0 TSval=377717443 TSecr=905122102
  210 120.295148567 13.225.230.11 → 192.168.8.174 TCP 66 443 → 49166 [FIN, ACK] Seq=93 Ack=171 Win=122 Len=0 TSval=377717443 TSecr=905122103
  211 120.295297837 192.168.8.174 → 13.225.230.11 TCP 66 49166 → 443 [ACK] Seq=171 Ack=94 Win=237 Len=0 TSval=905122109 TSecr=377717443
  212 125.623226770 192.168.8.174 → 151.101.1.140 TLSv1.2 112 Application Data
  213 125.639327525 151.101.1.140 → 192.168.8.174 TLSv1.2 112 Application Data
  214 125.639504504 192.168.8.174 → 151.101.1.140 TCP 66 36058 → 443 [ACK] Seq=139 Ack=139 Win=2564 Len=0 TSval=4223095436 TSecr=2541136839
  215 127.962657900 GuangLia_09:95:60 → LLDP_Multicast LLDP 196 TTL = 120 System Name = tumbleweed-router.lan System Description = OpenWrt 18.06.1 @ tumbleweed-router 
  216 131.184291707 192.168.8.174 → 151.101.1.140 TLSv1.2 112 Application Data
  217 131.185596857 192.168.8.174 → 151.101.1.140 TLSv1.2 97 Encrypted Alert
  218 131.185679513 192.168.8.174 → 151.101.1.140 TCP 66 36058 → 443 [FIN, ACK] Seq=216 Ack=139 Win=2564 Len=0 TSval=4223100982 TSecr=2541136839
  219 131.194631032 151.101.1.140 → 192.168.8.174 TCP 66 443 → 36058 [ACK] Seq=139 Ack=216 Win=282 Len=0 TSval=2541138229 TSecr=4223100981
  220 131.195805193 151.101.1.140 → 192.168.8.174 TLSv1.2 97 Encrypted Alert
  221 131.195894515 192.168.8.174 → 151.101.1.140 TCP 54 36058 → 443 [RST] Seq=217 Win=0 Len=0
  222 131.198129921 151.101.1.140 → 192.168.8.174 TCP 66 443 → 36058 [FIN, ACK] Seq=170 Ack=217 Win=282 Len=0 TSval=2541138230 TSecr=4223100982
  223 131.198185285 192.168.8.174 → 151.101.1.140 TCP 54 36058 → 443 [RST] Seq=217 Win=0 Len=0
  224 135.185201646 fe80::e695:6eff:fe49:9560 → ff02::1      ICMPv6 174 Router Advertisement from e4:95:6e:49:95:60
  225 135.200388134 fe80::206f:f4d8:f17e:534b → ff02::16     ICMPv6 150 Multicast Listener Report Message v2
  226 135.883628293 fe80::206f:f4d8:f17e:534b → ff02::16     ICMPv6 150 Multicast Listener Report Message v2
  227 136.202438666 GuangLia_09:95:60 → Raspberr_fa:9c:3e ARP 60 Who has 192.168.8.174? Tell 192.168.8.1
  228 136.202520071 Raspberr_fa:9c:3e → GuangLia_09:95:60 ARP 42 192.168.8.174 is at b8:27:eb:fa:9c:3e
  229 157.992668684 GuangLia_09:95:60 → LLDP_Multicast LLDP 196 TTL = 120 System Name = tumbleweed-router.lan System Description = OpenWrt 18.06.1 @ tumbleweed-router 
  230 188.022693006 GuangLia_09:95:60 → LLDP_Multicast LLDP 196 TTL = 120 System Name = tumbleweed-router.lan System Description = OpenWrt 18.06.1 @ tumbleweed-router 
  231 201.634450827 fe80::206f:f4d8:f17e:534b → ff02::1:2    DHCPv6 142 Solicit XID: 0xe018af CID: 00044814b8f23c364c102fa474664a5ca603 
  232 206.682742855 fe80::e695:6eff:fe49:9560 → ff02::1:ff7e:534b ICMPv6 86 Neighbor Solicitation for fe80::206f:f4d8:f17e:534b from e4:95:6e:49:95:60
  233 207.722666887 fe80::e695:6eff:fe49:9560 → ff02::1:ff7e:534b ICMPv6 86 Neighbor Solicitation for fe80::206f:f4d8:f17e:534b from e4:95:6e:49:95:60
  234 208.762679145 fe80::e695:6eff:fe49:9560 → ff02::1:ff7e:534b ICMPv6 86 Neighbor Solicitation for fe80::206f:f4d8:f17e:534b from e4:95:6e:49:95:60
  235 211.803200787 fe80::e695:6eff:fe49:9560 → ff02::1:ff7e:534b ICMPv6 86 Neighbor Solicitation for fe80::206f:f4d8:f17e:534b from e4:95:6e:49:95:60
  236 212.842650178 fe80::e695:6eff:fe49:9560 → ff02::1:ff7e:534b ICMPv6 86 Neighbor Solicitation for fe80::206f:f4d8:f17e:534b from e4:95:6e:49:95:60
  237 213.882731387 fe80::e695:6eff:fe49:9560 → ff02::1:ff7e:534b ICMPv6 86 Neighbor Solicitation for fe80::206f:f4d8:f17e:534b from e4:95:6e:49:95:60
  238 218.032724591 GuangLia_09:95:60 → LLDP_Multicast LLDP 196 TTL = 120 System Name = tumbleweed-router.lan System Description = OpenWrt 18.06.1 @ tumbleweed-router 
  239 248.062689360 GuangLia_09:95:60 → LLDP_Multicast LLDP 196 TTL = 120 System Name = tumbleweed-router.lan System Description = OpenWrt 18.06.1 @ tumbleweed-router 
  240 278.092724048 GuangLia_09:95:60 → LLDP_Multicast LLDP 196 TTL = 120 System Name = tumbleweed-router.lan System Description = OpenWrt 18.06.1 @ tumbleweed-router 
  241 308.122763153 GuangLia_09:95:60 → LLDP_Multicast LLDP 196 TTL = 120 System Name = tumbleweed-router.lan System Description = OpenWrt 18.06.1 @ tumbleweed-router 
  242 318.456494575 fe80::206f:f4d8:f17e:534b → ff02::1:2    DHCPv6 142 Solicit XID: 0xe018af CID: 00044814b8f23c364c102fa474664a5ca603 
  243 323.482751456 fe80::e695:6eff:fe49:9560 → ff02::1:ff7e:534b ICMPv6 86 Neighbor Solicitation for fe80::206f:f4d8:f17e:534b from e4:95:6e:49:95:60
  244 324.522688088 fe80::e695:6eff:fe49:9560 → ff02::1:ff7e:534b ICMPv6 86 Neighbor Solicitation for fe80::206f:f4d8:f17e:534b from e4:95:6e:49:95:60
  245 325.562729822 fe80::e695:6eff:fe49:9560 → ff02::1:ff7e:534b ICMPv6 86 Neighbor Solicitation for fe80::206f:f4d8:f17e:534b from e4:95:6e:49:95:60
  246 328.498038260 fe80::e695:6eff:fe49:9560 → ff02::1:ff7e:534b ICMPv6 86 Neighbor Solicitation for fe80::206f:f4d8:f17e:534b from e4:95:6e:49:95:60
  247 329.562708404 fe80::e695:6eff:fe49:9560 → ff02::1:ff7e:534b ICMPv6 86 Neighbor Solicitation for fe80::206f:f4d8:f17e:534b from e4:95:6e:49:95:60
  248 330.602705862 fe80::e695:6eff:fe49:9560 → ff02::1:ff7e:534b ICMPv6 86 Neighbor Solicitation for fe80::206f:f4d8:f17e:534b from e4:95:6e:49:95:60
  249 338.132723719 GuangLia_09:95:60 → LLDP_Multicast LLDP 196 TTL = 120 System Name = tumbleweed-router.lan System Description = OpenWrt 18.06.1 @ tumbleweed-router 
  250 368.162769873 GuangLia_09:95:60 → LLDP_Multicast LLDP 196 TTL = 120 System Name = tumbleweed-router.lan System Description = OpenWrt 18.06.1 @ tumbleweed-router 
  251 398.192774120 GuangLia_09:95:60 → LLDP_Multicast LLDP 196 TTL = 120 System Name = tumbleweed-router.lan System Description = OpenWrt 18.06.1 @ tumbleweed-router 
  252 428.222786150 GuangLia_09:95:60 → LLDP_Multicast LLDP 196 TTL = 120 System Name = tumbleweed-router.lan System Description = OpenWrt 18.06.1 @ tumbleweed-router 
  253 440.329158117 fe80::206f:f4d8:f17e:534b → ff02::1:2    DHCPv6 142 Solicit XID: 0xe018af CID: 00044814b8f23c364c102fa474664a5ca603 
  254 445.402792804 fe80::e695:6eff:fe49:9560 → ff02::1:ff7e:534b ICMPv6 86 Neighbor Solicitation for fe80::206f:f4d8:f17e:534b from e4:95:6e:49:95:60
  255 446.442756543 fe80::e695:6eff:fe49:9560 → ff02::1:ff7e:534b ICMPv6 86 Neighbor Solicitation for fe80::206f:f4d8:f17e:534b from e4:95:6e:49:95:60
  256 447.482765438 fe80::e695:6eff:fe49:9560 → ff02::1:ff7e:534b ICMPv6 86 Neighbor Solicitation for fe80::206f:f4d8:f17e:534b from e4:95:6e:49:95:60
  257 447.483659704  192.168.8.1 → 192.168.8.174 ICMP 98 Echo (ping) request  id=0x106f, seq=0/0, ttl=64
  258 447.483764130 192.168.8.174 → 192.168.8.1  ICMP 98 Echo (ping) reply    id=0x106f, seq=0/0, ttl=64 (request in 257)
  259 450.527564229 fe80::e695:6eff:fe49:9560 → ff02::1:ff7e:534b ICMPv6 86 Neighbor Solicitation for fe80::206f:f4d8:f17e:534b from e4:95:6e:49:95:60
  260 451.562754291 fe80::e695:6eff:fe49:9560 → ff02::1:ff7e:534b ICMPv6 86 Neighbor Solicitation for fe80::206f:f4d8:f17e:534b from e4:95:6e:49:95:60
  261 452.522524020 GuangLia_09:95:60 → Raspberr_fa:9c:3e ARP 60 Who has 192.168.8.174? Tell 192.168.8.1
  262 452.522616832 Raspberr_fa:9c:3e → GuangLia_09:95:60 ARP 42 192.168.8.174 is at b8:27:eb:fa:9c:3e
  263 452.559972312 Raspberr_fa:9c:3e → GuangLia_09:95:60 ARP 42 Who has 192.168.8.1? Tell 192.168.8.174
  264 452.560350904 GuangLia_09:95:60 → Raspberr_fa:9c:3e ARP 60 192.168.8.1 is at e4:95:6e:49:95:60
  265 452.602723493 fe80::e695:6eff:fe49:9560 → ff02::1:ff7e:534b ICMPv6 86 Neighbor Solicitation for fe80::206f:f4d8:f17e:534b from e4:95:6e:49:95:60
  266 458.232756591 GuangLia_09:95:60 → LLDP_Multicast LLDP 196 TTL = 120 System Name = tumbleweed-router.lan System Description = OpenWrt 18.06.1 @ tumbleweed-router 
  267 488.262787468 GuangLia_09:95:60 → LLDP_Multicast LLDP 196 TTL = 120 System Name = tumbleweed-router.lan System Description = OpenWrt 18.06.1 @ tumbleweed-router 
  268 518.292773776 GuangLia_09:95:60 → LLDP_Multicast LLDP 196 TTL = 120 System Name = tumbleweed-router.lan System Description = OpenWrt 18.06.1 @ tumbleweed-router 
  269 548.322794309 GuangLia_09:95:60 → LLDP_Multicast LLDP 196 TTL = 120 System Name = tumbleweed-router.lan System Description = OpenWrt 18.06.1 @ tumbleweed-router 
  270 553.871239535 fe80::206f:f4d8:f17e:534b → ff02::1:2    DHCPv6 142 Solicit XID: 0xe018af CID: 00044814b8f23c364c102fa474664a5ca603 
  271 558.922794486 fe80::e695:6eff:fe49:9560 → ff02::1:ff7e:534b ICMPv6 86 Neighbor Solicitation for fe80::206f:f4d8:f17e:534b from e4:95:6e:49:95:60
  272 559.962769742 fe80::e695:6eff:fe49:9560 → ff02::1:ff7e:534b ICMPv6 86 Neighbor Solicitation for fe80::206f:f4d8:f17e:534b from e4:95:6e:49:95:60
  273 561.002790309 fe80::e695:6eff:fe49:9560 → ff02::1:ff7e:534b ICMPv6 86 Neighbor Solicitation for fe80::206f:f4d8:f17e:534b from e4:95:6e:49:95:60
  274 564.020686929 fe80::e695:6eff:fe49:9560 → ff02::1:ff7e:534b ICMPv6 86 Neighbor Solicitation for fe80::206f:f4d8:f17e:534b from e4:95:6e:49:95:60
  275 565.082747115 fe80::e695:6eff:fe49:9560 → ff02::1:ff7e:534b ICMPv6 86 Neighbor Solicitation for fe80::206f:f4d8:f17e:534b from e4:95:6e:49:95:60
  276 566.122768043 fe80::e695:6eff:fe49:9560 → ff02::1:ff7e:534b ICMPv6 86 Neighbor Solicitation for fe80::206f:f4d8:f17e:534b from e4:95:6e:49:95:60
  277 578.332847341 GuangLia_09:95:60 → LLDP_Multicast LLDP 196 TTL = 120 System Name = tumbleweed-router.lan System Description = OpenWrt 18.06.1 @ tumbleweed-router 
  278 608.362799571 GuangLia_09:95:60 → LLDP_Multicast LLDP 196 TTL = 120 System Name = tumbleweed-router.lan System Description = OpenWrt 18.06.1 @ tumbleweed-router 
  279 624.263475641 fe80::e695:6eff:fe49:9560 → ff02::1      ICMPv6 174 Router Advertisement from e4:95:6e:49:95:60
  280 624.273678346 fe80::206f:f4d8:f17e:534b → ff02::16     ICMPv6 150 Multicast Listener Report Message v2
  281 624.740866966 fe80::206f:f4d8:f17e:534b → ff02::16     ICMPv6 150 Multicast Listener Report Message v2
  282 638.392841195 GuangLia_09:95:60 → LLDP_Multicast LLDP 196 TTL = 120 System Name = tumbleweed-router.lan System Description = OpenWrt 18.06.1 @ tumbleweed-router 
  283 668.422833341 GuangLia_09:95:60 → LLDP_Multicast LLDP 196 TTL = 120 System Name = tumbleweed-router.lan System Description = OpenWrt 18.06.1 @ tumbleweed-router 
  284 685.729519491 fe80::206f:f4d8:f17e:534b → ff02::1:2    DHCPv6 142 Solicit XID: 0xe018af CID: 00044814b8f23c364c102fa474664a5ca603 
  285 690.762892855 fe80::e695:6eff:fe49:9560 → ff02::1:ff7e:534b ICMPv6 86 Neighbor Solicitation for fe80::206f:f4d8:f17e:534b from e4:95:6e:49:95:60
  286 691.802806355 fe80::e695:6eff:fe49:9560 → ff02::1:ff7e:534b ICMPv6 86 Neighbor Solicitation for fe80::206f:f4d8:f17e:534b from e4:95:6e:49:95:60
  287 692.842803760 fe80::e695:6eff:fe49:9560 → ff02::1:ff7e:534b ICMPv6 86 Neighbor Solicitation for fe80::206f:f4d8:f17e:534b from e4:95:6e:49:95:60
  288 696.927777795 fe80::e695:6eff:fe49:9560 → ff02::1:ff7e:534b ICMPv6 86 Neighbor Solicitation for fe80::206f:f4d8:f17e:534b from e4:95:6e:49:95:60
  289 697.962761526 fe80::e695:6eff:fe49:9560 → ff02::1:ff7e:534b ICMPv6 86 Neighbor Solicitation for fe80::206f:f4d8:f17e:534b from e4:95:6e:49:95:60
  290 698.432850890 GuangLia_09:95:60 → LLDP_Multicast LLDP 196 TTL = 120 System Name = tumbleweed-router.lan System Description = OpenWrt 18.06.1 @ tumbleweed-router 
  291 699.002799292 fe80::e695:6eff:fe49:9560 → ff02::1:ff7e:534b ICMPv6 86 Neighbor Solicitation for fe80::206f:f4d8:f17e:534b from e4:95:6e:49:95:60
  292 728.462857562 GuangLia_09:95:60 → LLDP_Multicast LLDP 196 TTL = 120 System Name = tumbleweed-router.lan System Description = OpenWrt 18.06.1 @ tumbleweed-router 
  293 758.492869588 GuangLia_09:95:60 → LLDP_Multicast LLDP 196 TTL = 120 System Name = tumbleweed-router.lan System Description = OpenWrt 18.06.1 @ tumbleweed-router 
  294 769.860927201  192.168.8.1 → 192.168.8.174 ICMP 98 Echo (ping) request  id=0x2b7d, seq=0/0, ttl=64
  295 769.861093971 192.168.8.174 → 192.168.8.1  ICMP 98 Echo (ping) reply    id=0x2b7d, seq=0/0, ttl=64 (request in 294)
  296 774.879974273 Raspberr_fa:9c:3e → GuangLia_09:95:60 ARP 42 Who has 192.168.8.1? Tell 192.168.8.174
  297 774.880362396 GuangLia_09:95:60 → Raspberr_fa:9c:3e ARP 60 192.168.8.1 is at e4:95:6e:49:95:60
  298 774.922621018 GuangLia_09:95:60 → Raspberr_fa:9c:3e ARP 60 Who has 192.168.8.174? Tell 192.168.8.1
  299 774.922678413 Raspberr_fa:9c:3e → GuangLia_09:95:60 ARP 42 192.168.8.174 is at b8:27:eb:fa:9c:3e
  300 788.522849651 GuangLia_09:95:60 → LLDP_Multicast LLDP 196 TTL = 120 System Name = tumbleweed-router.lan System Description = OpenWrt 18.06.1 @ tumbleweed-router 
  301 806.963084251  192.168.8.1 → 192.168.8.255 BROWSER 256 Local Master Announcement GL-AR750S, Workstation, Server, Print Queue Server, Xenix Server, NT Workstation, NT Server, Master Browser, Domain Master Browser, DFS server
  302 806.963388260  192.168.8.1 → 192.168.8.255 BROWSER 252 Domain/Workgroup Announcement WORKGROUP, NT Workstation, Domain Enum
  303 808.398802592 fe80::206f:f4d8:f17e:534b → ff02::1:2    DHCPv6 142 Solicit XID: 0xe018af CID: 00044814b8f23c364c102fa474664a5ca603 
  304 813.402929968 fe80::e695:6eff:fe49:9560 → ff02::1:ff7e:534b ICMPv6 86 Neighbor Solicitation for fe80::206f:f4d8:f17e:534b from e4:95:6e:49:95:60
  305 814.442838715 fe80::e695:6eff:fe49:9560 → ff02::1:ff7e:534b ICMPv6 86 Neighbor Solicitation for fe80::206f:f4d8:f17e:534b from e4:95:6e:49:95:60
  306 815.482873816 fe80::e695:6eff:fe49:9560 → ff02::1:ff7e:534b ICMPv6 86 Neighbor Solicitation for fe80::206f:f4d8:f17e:534b from e4:95:6e:49:95:60
  307 818.528404527 fe80::e695:6eff:fe49:9560 → ff02::1:ff7e:534b ICMPv6 86 Neighbor Solicitation for fe80::206f:f4d8:f17e:534b from e4:95:6e:49:95:60
  308 818.532876638 GuangLia_09:95:60 → LLDP_Multicast LLDP 196 TTL = 120 System Name = tumbleweed-router.lan System Description = OpenWrt 18.06.1 @ tumbleweed-router 
  309 819.562806168 fe80::e695:6eff:fe49:9560 → ff02::1:ff7e:534b ICMPv6 86 Neighbor Solicitation for fe80::206f:f4d8:f17e:534b from e4:95:6e:49:95:60
  310 820.602871266 fe80::e695:6eff:fe49:9560 → ff02::1:ff7e:534b ICMPv6 86 Neighbor Solicitation for fe80::206f:f4d8:f17e:534b from e4:95:6e:49:95:60
  311 848.562897071 GuangLia_09:95:60 → LLDP_Multicast LLDP 196 TTL = 120 System Name = tumbleweed-router.lan System Description = OpenWrt 18.06.1 @ tumbleweed-router 
  312 878.592901344 GuangLia_09:95:60 → LLDP_Multicast LLDP 196 TTL = 120 System Name = tumbleweed-router.lan System Description = OpenWrt 18.06.1 @ tumbleweed-router 
  313 899.991476069 192.168.8.174 → 8.8.4.4      DNS 74 Standard query 0xaf55 A www.reddit.com
  314 899.991553777 192.168.8.174 → 8.8.8.8      DNS 74 Standard query 0xaf55 A www.reddit.com
  315 899.991742422 192.168.8.174 → 8.8.8.8      DNS 74 Standard query 0x9524 AAAA www.reddit.com
  316 899.992098670 192.168.8.174 → 8.8.8.8      DNS 74 Standard query 0x4c24 A www.reddit.com
  317 900.013619852      8.8.8.8 → 192.168.8.174 DNS 167 Standard query response 0x9524 AAAA www.reddit.com CNAME reddit.map.fastly.net SOA ns1.fastly.net
  318 900.013624852      8.8.4.4 → 192.168.8.174 DNS 173 Standard query response 0xaf55 A www.reddit.com CNAME reddit.map.fastly.net A 151.101.1.140 A 151.101.65.140 A 151.101.129.140 A 151.101.193.140
  319 900.013837611      8.8.8.8 → 192.168.8.174 DNS 173 Standard query response 0xaf55 A www.reddit.com CNAME reddit.map.fastly.net A 151.101.1.140 A 151.101.65.140 A 151.101.129.140 A 151.101.193.140
